{
  "protocolVersion": "1.0",
  "messageId": "33333333-3333-4333-8333-333333333333",
  "messageType": "server.hello",
  "sessionId": "44444444-4444-4444-8444-444444444444",
  "correlationId": "11111111-1111-4111-8111-111111111111",
  "timestamp": "2026-10-06T12:00:01Z",
  "expiresAt": "2026-10-06T12:15:01Z",
  "payload": {
    "serverVersion": "0.1.0",
    "selectedProtocolVersion": "1.0",
    "compatibility": "compatible",
    "createdAt": "2026-10-06T12:00:01Z",
    "heartbeatIntervalSeconds": 3,
    "resumeToken": "synthetic-development-token-0000000000000000",
    "negotiatedCapabilities": [],
    "developmentOnly": true
  }
}
